sentence,intent,,,,
동파육 맛있게 만드는 방법 좀 알려줄래?,1,,,,
돼지 갈비 맛있게 만들려면 어떻게 해야 해?,1,,,,
돼지 갈비구이 어떻게 만들어야 맛있어?,1,,,,
돼지갈비 맛있게 만드는 방법 좀 알려줄래?,1,,,,
돼지갈비구이 만드는 방법 좀 가르쳐줄래?,1,,,,
돼지갈비찜 만드는 법 알려줄래?,1,,,,
돼지갈비찜 황금레시피 공유해줄래?,1,,,,
돼지고기 김치찜 맛있게 만드는 법 알려줄래?,1,,,,
돼지고기 탕수육 황금레시피 좀 알려줘,1,,,,
돼지고기표고볶음 황금레시피 공유해줄래?,1,,,,
돼지국밥 맛있게 만드는 방법 알려줄래?,1,,,,
돼지불고기 맛있게 만드는 법 알려줘,1,,,,
된장국 만드는 법 좀 알려줄 수 있을까?,1,,,,
된장국 맛있게 만드는 방법 알려줄래?,1,,,,
된장국 맛있게 만드는 법 좀 알려줄래?,1,,,,
된장깻잎장아찌 황금레시피 공유해줄래?,1,,,,
된장찌개 맛있게 끓이는 꿀방법 있으면 알려줘! 맨날 2% 부족한 맛이야.,1,,,,
된장찌개 맛있게 만드는 방법 알려줘,1,,,,
된장찌개 맛있게 만드는 방법 좀 알려줄래?,1,,,,
된장찌개 어떻게 만들면 좋을까?,1,,,,
된장찌개 황금레시피 좀 알려줘,1,,,,
두릅된장무침 만드는 방법 좀 가르쳐줄래?,1,,,,
두부 국 황금 레시피 좀 공유해줄래?,1,,,,
두부 김치 맛있게 만드는 방법 좀 가르쳐줘.,1,,,,
두부 다시마 말이 어떻게 만들어야 해?,1,,,,
두부 드레싱과 채소 샐러드 어떻게 만들어야 해?,1,,,,
두부 맛있게 만드는 방법 알고 싶어,1,,,,
두부 미역 냉채 어떻게 만들어야 해?,1,,,,
두부 스테이크 맛있게 만드는 법 알려줄래?,1,,,,
두부 양념 조림 맛있게 만드는 법 좀 가르쳐줘.,1,,,,
두부 조개탕 어떻게 만들어야 해?,1,,,,
두부국 맛있게 만드는 방법 좀 가르쳐줄래?,1,,,,
두부굴찌개 맛있게 만드는 법 좀 알려줘.,1,,,,
두부김치 맛있게 만드는 법 알려줘,1,,,,
두부김치 어떻게 만들면 좋을까?,1,,,,
두부김치 황금레시피 좀 공유해줄래?,1,,,,
두부다시마말이 맛있게 만드는 법 알려줘.,1,,,,
두부덮밥 어떻게 만들면 좋을까?,1,,,,
두부두루치기 맛있게 만드는 법 좀 알려줘.,1,,,,
두부드레싱과 채소샐러드 만드는 방법 좀 알려줄래?,1,,,,
두부무침 어떻게 만들면 좋을까?,1,,,,
두부미역냉채 황금레시피 공유해줄래?,1,,,,
두부스테이크 만드는 방법 좀 가르쳐줄래?,1,,,,
두부알찜 황금레시피 공유해줄래?,1,,,,
두부양념조림 만드는 방법 좀 가르쳐줄래?,1,,,,
두부오믈렛 황금레시피 공유해줄래?,1,,,,
두부요리 맛있게 만드는 법 좀 알려줄래?,1,,,,
두부전골 맛있게 만드는 법 알려줘,1,,,,
두부조개탕 만드는 방법 좀 알려줄 수 있어?,1,,,,
두부조림 어떻게 만들면 좋을까?,1,,,,
두부조림 황금레시피 좀 알려줘,1,,,,
두부채소냉채 맛있게 만드는 법 좀 알려줘.,1,,,,
두부카나페 맛있게 만드는 법 좀 알려줘.,1,,,,
두부탕 황금레시피 공유해줄래?,1,,,,
딤섬 만드는 법 좀 알려줄 수 있어? 집에서 만들어 보고 싶은데 어려울까 봐 걱정돼.,1,,,,
떡갈비 구이 황금 레시피 좀 알려줄래?,1,,,,
떡갈비 맛있게 만드는 방법 알고 싶어,1,,,,
떡갈비 황금레시피 좀 알려줘,1,,,,
떡갈비구이 맛있게 만드는 법 좀 알려줘.,1,,,,
떡갈비샌드위치 맛있게 만드는 법 좀 알려줘.,1,,,,
떡국 떡 쫄깃하게 끓이는 방법 좀 알려줄 수 있어? 퍼지는 게 싫어.,1,,,,
떡국 만드는 방법 좀 가르쳐줄래?,1,,,,
떡국 맛있게 만드는 법 좀 알려줄래?,1,,,,
떡국 어떻게 만들면 좋을까?,1,,,,
떡꼬치 맛있게 만드는 방법 알려줘,1,,,,
떡만둣국 맛있게 만드는 법 알려줘,1,,,,
떡볶이 만드는 방법 좀 가르쳐줄래?,1,,,,
떡볶이 만드는 법 좀 알려줄 수 있어?,1,,,,
떡볶이 맛있게 만드는 방법 알고 싶어,1,,,,
떡볶이 맛있게 만드는 법 알려줄래?,1,,,,
떡볶이 맛있게 만드는 법 알려줘,1,,,,
떡볶이 황금 레시피 있으면 알려주라! 완전 똥손이라...,1,,,,
떡잡채 만드는 방법 좀 가르쳐줄래?,1,,,,
똠얌꿍 맛있게 만드는 법 좀 알려줄래?,1,,,,
똠얌꿍 맛있게 만들려면 어떻게 해야 해?,1,,,,
라따뚜이 만드는 법 좀 알려줘!,1,,,,
라멘 육수 깊은 맛 내는 방법 좀 알려주라. 밖에서 사 먹는 맛이 안 나.,1,,,,
라볶이 황금레시피 공유해줄래?,1,,,,
라자냐 만드는 법 좀 알려줄래?,1,,,,
라자냐 맛있게 만드는 법 좀 알려줘.,1,,,,
라자냐 맛있게 만들려면 어떻게 해야 해?,1,,,,
랍스터 롤 맛있게 만드는 방법 공유해줄래?,1,,,,
랍스터 비스크 황금레시피 좀 알려줘,1,,,,
랍스터 요리 맛있게 만드는 법 좀 알려줄래?,1,,,,
랍스터 파스타 만드는 방법 알려줄래?,1,,,,
레몬 갈릭 새우 황금레시피 좀 알려줘,1,,,,
레몬 치킨 만드는 법 좀 공유해줘,1,,,,
레몬 치킨 맛있게 만들려면 어떻게 해야 해?,1,,,,
로브스터 비스크 맛있게 만드는 법 좀 알려줘!,1,,,,
로스트 비프 만드는 법 좀 알려줄 수 있어?,1,,,,
로스트 비프 황금레시피 좀 알려줘,1,,,,
로스트 치킨 황금레시피 좀 알려줘,1,,,,
로스트 터키 황금레시피 좀 알려줘,1,,,,
롤케 비지(양배추 말이) 황금 레시피 좀 공유해줄래?,1,,,,
롤케비지(양배추말이) 맛있게 만드는 법 알려줘.,1,,,,
류산슬 맛있게 만드는 법 좀 알려줘.,1,,,,
리조또 밥알 안 퍼지게 만드는 방법 좀 알려줄래?,1,,,,
마늘 새우 만드는 법 좀 알려줄 수 있어?,1,,,,
마늘 장아찌 황금 레시피 좀 알려줘.,1,,,,
마늘 치킨 만드는 법 좀 알려줄 수 있어?,1,,,,
마늘빵 맛있게 만드는 법 좀 알려줘.,1,,,,
마늘장아찌 만드는 방법 좀 알려줄래?,1,,,,
마라샹궈 어떻게 만들면 좋을까?,1,,,,
마라탕 맛있게 만드는 방법 좀 알려주세요. 마라 초보라 뭐 넣어야 할지 모르겠어.,1,,,,
마르게리타 피자 만드는 법 좀 알려줄 수 있어?,1,,,,
마르게리타 피자 황금레시피 좀 알려줘,1,,,,
마른오징어 조림 어떻게 만들어야 맛있어?,1,,,,
마른오징어조림 황금레시피 좀 공유해줄래?,1,,,,
마카로니 샐러드 맛있게 만드는 법 좀 알려줄래?,1,,,,
마카로니 치즈 맛있게 만드는 법 좀 알려줄래?,1,,,,
마카로니 치즈 황금레시피 좀 알려줘,1,,,,
마파두부 만드는 법 알려줄 수 있을까?,1,,,,
마파두부 맛있게 만드는 법 좀 알려줄래?,1,,,,
마파두부 맛있게 만들려면 어떻게 해야 해?,1,,,,
마파두부 맵기 조절하는 방법 좀 알려줄 수 있어? 매운 거 잘 못 먹어.,1,,,,
막창 만드는 법 알려줄래?,1,,,,
만두 국 만드는 법 좀 가르쳐줘.,1,,,,
만두샐러드 황금레시피 공유해줄래?,1,,,,
만둣국 만드는 방법 좀 알려줄 수 있을까?,1,,,,
말린과일 만드는 법 알려줄래?,1,,,,
맑은떡국 황금레시피 공유해줄래?,1,,,,
매운 닭날개 맛있게 만드는 법 좀 알려줄래?,1,,,,
매운갈비찜 맛있게 만드는 법 좀 알려줄래?,1,,,,
매운족발 맛있게 만드는 법 알려줘,1,,,,
매운탕 어떻게 만들면 좋을까?,1,,,,
매운탕 황금레시피 좀 알려줘,1,,,,
맥심골드 만드는 법 알려줄래?,1,,,,
멕시칸 부리토 어떻게 만들면 맛있게 할 수 있을까?,1,,,,
멕시칸 퀘사디아 만드는 법 좀 알려줄 수 있어?,1,,,,
멘보샤 맛있게 튀기는 방법 좀 알려주세요. 기름 많이 튀는 게 싫어.,1,,,,
멘보샤 황금레시피 좀 알려줘,1,,,,
멸치 볶음 어떻게 만들어야 맛있어?,1,,,,
멸치볶음 맛있게 만드는 방법 알고 싶어,1,,,,
멸치볶음 맛있게 만드는 법 알려줄래?,1,,,,
명란스파게티 맛있게 만드는 방법 알고 싶어,1,,,,
명란젓 만드는 법 알려줄래?,1,,,,
명란젓찌개 맛있게 만드는 법 좀 알려줘.,1,,,,
명이나물 만드는 법 알려줘,1,,,,
모닥치기 맛있게 만드는 방법 알려줘,1,,,,
모듬 초밥 황금 레시피 좀 알려줄래?,1,,,,
모듬쌈밥 황금레시피 공유해줄래?,1,,,,
모듬전 맛있게 만드는 법 좀 알려줘.,1,,,,
모듬채소볶음 만드는 방법 좀 가르쳐줄래?,1,,,,
모듬초밥 맛있게 만드는 법 좀 알려줘.,1,,,,
모찌롤 맛있게 만드는 방법 알려줄래?,1,,,,
모히토 만드는 법 좀 알려줘!,1,,,,
무 맑은국 맛있게 만드는 법 좀 알려줘.,1,,,,
무나물 황금레시피 공유해줄래?,1,,,,
무맑은국 황금레시피 좀 공유해줄래?,1,,,,
무생채 맛있게 만드는 법 좀 알려줘.,1,,,,
무지개떡 맛있게 만드는 방법 알려줘,1,,,,
무초김치 만드는 방법 좀 가르쳐줄래?,1,,,,
묵과 양념장 맛있게 만드는 법 좀 알려줄래?,1,,,,
묵과양념장 만드는 방법 좀 가르쳐줄래?,1,,,,
묵은지김치찜 맛있게 만드는 법 알려줘,1,,,,
묵은지찜 맛있게 만드는 법 알려줘,1,,,,
물냉면 만드는 법 알려줄래?,1,,,,
물만두 만드는 방법 좀 가르쳐줄래?,1,,,,
물만두 맛있게 만드는 방법 알려줘,1,,,,
물회 맛있게 만드는 방법 알고 싶어,1,,,,
미네스트로네 만드는 법 알려줄 수 있어?,1,,,,
미네스트로네 만드는 법 좀 알려줄 수 있어?,1,,,,
미소 라멘 맛있게 만드는 방법 알려줘,1,,,,
미숫가루 만드는 법 좀 알려줄 수 있을까?,1,,,,
미역 냉국 어떻게 만들어야 맛있어?,1,,,,
미역국 만드는 법 알려줄래?,1,,,,
미역국 만드는 법 좀 가르쳐줄래?,1,,,,
미역국 맛있게 만드는 방법 알려줘.,1,,,,
미역국 맛있게 만드는 법 좀 알려줄래?,1,,,,
미역냉국 만드는 법 좀 알려줄래?,1,,,,
미역냉국 어떻게 만들면 좋을까?,1,,,,
미트로프 맛있게 만드는 법 알려줄래?,1,,,,
미트볼 파스타 만드는 방법 알려줄 수 있을까?,1,,,,
미트볼 파스타 황금레시피 좀 알려줘,1,,,,
미트볼 황금레시피 좀 알려줘,1,,,,
바나나 브레드 만드는 법 좀 알려줄 수 있어?,1,,,,
바나나맛우유 맛있게 만드는 방법 알려줄래?,1,,,,
바바리안 프레첼 만드는 법 좀 알려줘!,1,,,,
바베큐 폭립 황금레시피 좀 알려줄래?,1,,,,
바지락볶음 황금레시피 공유해줄래?,1,,,,
바지락칼국수 만드는 방법 좀 가르쳐줄래?,1,,,,
바질 치킨 황금레시피 좀 알려줘,1,,,,
바질 토마토 두부 샐러드 만드는 법 좀 가르쳐줘.,1,,,,
바질 페스토 황금레시피 좀 알려줘,1,,,,
바질토마토두부샐러드 만드는 방법 좀 가르쳐줘.,1,,,,
배추 겉절이 어떻게 만들어야 해?,1,,,,
배추겉절이 황금레시피 공유해줄래?,1,,,,
배추김치 맛있게 만드는 방법 알고 싶어,1,,,,
배추밤김치 황금레시피 공유해줄래?,1,,,,
배추속댓국 황금레시피 공유해줄래?,1,,,,
백 김치 어떻게 만들어야 맛있어?,1,,,,
백김치 만드는 방법 좀 가르쳐줄래?,1,,,,
백김치 만드는 법 알려줄래?,1,,,,
뱅쇼 만드는 방법 좀 알려줘! 겨울에 따뜻하게 마시고 싶어.,1,,,,
버블티 만드는 법 알려줄 수 있을까?,1,,,,
버섯 리조또 황금레시피 좀 알려줘,1,,,,
버섯덮밥 황금레시피 공유해줄래?,1,,,,
버섯두부찌개 황금레시피 공유해줄래?,1,,,,
버섯만두전골 맛있게 만드는 법 좀 알려줘.,1,,,,
버섯잡채밥 만드는 방법 좀 가르쳐줄래?,1,,,,
버섯청국장찌개 맛있게 만드는 법 좀 알려줘.,1,,,,
버섯파스타 황금레시피 공유해줄래?,1,,,,
버터 치킨 황금레시피 좀 알려줘,1,,,,
벌집삼겹살 맛있게 만드는 방법 좀 알려줄래?,1,,,,
베이글 만드는 법 좀 알려줘!,1,,,,
베이컨 라자냐 만드는 법 좀 알려줄 수 있어?,1,,,,
베이컨 랩 새우 만드는 법 좀 알려줄래?,1,,,,
베이컨 에그 샌드위치 만드는 법 좀 알려줄 수 있어?,1,,,,
베이컨꼬치구이 만드는 방법 좀 가르쳐줄래?,1,,,,
베지 버거 맛있게 만드는 법 좀 알려줄래?,1,,,,
베지터블 카레 만드는 법 좀 알려줄래?,1,,,,
베트남 쌀국수 만드는 법 좀 공유해줘,1,,,,
벤토 예쁘게 만드는 방법 좀 알려줄 수 있어? 도시락 싸는 똥손이라...,1,,,,
별미밥 만드는 방법 좀 가르쳐줄래?,1,,,,
보리밥 맛있게 만드는 방법 좀 알려줘,1,,,,
보쌈김치 만드는 방법 좀 가르쳐줄래?,1,,,,
볶음김치 맛있게 만드는 방법 알고 싶어,1,,,,
볶음밥 고슬고슬하게 만드는 비법 좀 알려줘! 맨날 질척거려.,1,,,,
볶음밥 맛있게 만드는 방법 알려줄래?,1,,,,
볶음쌀국수 맛있게 만드는 법 좀 알려줘.,1,,,,
볶음우동 만드는 방법 좀 가르쳐줄래?,1,,,,
볶음우동 맛있게 만드는 방법 알고 싶어,1,,,,
봄동바지락볶음 만드는 방법 좀 가르쳐줄래?,1,,,,
부대찌개 만드는 방법 좀 가르쳐줄래?,1,,,,
부추 김치 맛있게 만드는 법 좀 알려줄래?,1,,,,
부추 표고버섯 볶음 맛있게 만드는 방법 좀 가르쳐줘.,1,,,,
부추김치 맛있게 만드는 법 좀 알려줘.,1,,,,
부추부침개 황금레시피 공유해줄래?,1,,,,
부추전 만드는 법 좀 가르쳐줘.,1,,,,
부추전 황금레시피 좀 공유해줄래?,1,,,,
부추표고버섯볶음 황금레시피 좀 공유해줄래?,1,,,,
북어 국 황금 레시피 좀 공유해줄래?,1,,,,
북어국 만드는 방법 좀 가르쳐줘.,1,,,,
불고기 만드는 방법 좀 알려줄 수 있을까?,1,,,,
불고기 맛있게 만드는 법 알려줘,1,,,,
불고기 맛있게 만드는 법 좀 알려줄래?,1,,,,
불고기 맛있게 만드는 법 좀 알려줘.,1,,,,
불고기 양념 황금 비율 좀 알려줄 수 있어? 밖에서 사 먹는 맛 내고 싶어.,1,,,,
불고기 타코 맛있게 만드는 법 좀 알려줄래?,1,,,,
불고기 황금 레시피 좀 알려줄래?,1,,,,
불고기 황금레시피 좀 알려줘,1,,,,
불고기낙지전골 맛있게 만드는 법 좀 알려줘.,1,,,,
불고기덮밥 어떻게 만들면 좋을까?,1,,,,
불고기버거 만드는 법 좀 알려줄 수 있을까?,1,,,,
불고기찹쌀구이 황금레시피 공유해줄래?,1,,,,
붕어빵 맛있게 만드는 방법 알려줘,1,,,,
브라운 치킨 커리 어떻게 만들면 좋을까?,1,,,,
브로콜리크림수프 맛있게 만드는 법 좀 알려줘.,1,,,,
브리오슈 황금레시피 좀 알려줘,1,,,,
비빔국수 만드는 법 좀 공유해줘,1,,,,
비빔국수 맛있게 만드는 방법 알고 싶어,1,,,,
비빔국수 맛있게 만드는 법 알려줘,1,,,,
비빔국수 맛있게 만드는 법 좀 알려줄래?,1,,,,
비빔냉면 맛있게 만드는 방법 좀 알려줘,1,,,,
비빔냉면 맛있게 만드는 법 알고 싶어,1,,,,
비빔냉면 맛있게 만드는 법 알려줘,1,,,,
비빔밥 어떻게 만들면 좋을까?,1,,,,
비빔쌀국수 만드는 방법 좀 가르쳐줄래?,1,,,,
비지찌개 만드는 법 좀 알려줄 수 있을까?,1,,,,
비프 브리스킷 황금레시피 좀 알려줘,1,,,,
비프 타르타르 만드는 법 좀 공유해줘,1,,,,
빈대떡 맛있게 만드는 법 좀 알려줘.,1,,,,
뼈해장국 만드는 법 알려줄래?,1,,,,
뼈해장국 만드는 법 알려줘,1,,,,
사골우거지탕 맛있게 만드는 법 좀 알려줘.,1,,,,
사골탕 맛있게 만드는 법 좀 알려줘.,1,,,,
사색나물 황금레시피 공유해줄래?,1,,,,
사천식 마라탕 만드는 법 좀 알려줄 수 있어?,1,,,,
사케동 맛있게 만드는 방법 알려줄래?,1,,,,
삼겹살 구이 어떻게 만들면 맛있게 할 수 있을까?,1,,,,
삼겹살 김치찜 만드는 법 좀 공유해줘,1,,,,
삼겹살 김치찜 만드는 법 좀 알려줄래?,1,,,,
삼겹살 맛있게 만드는 법 알려줘,1,,,,
삼겹살구이 맛있게 만드는 법 알려줘,1,,,,
삼겹살깻잎전 맛있게 만드는 법 좀 알려줘.,1,,,,
삼겹살채소말이 맛있게 만드는 법 좀 알려줘.,1,,,,
삼겹살치즈구이 황금레시피 공유해줄래?,1,,,,
삼계탕 닭 냄새 없애는 방법 좀 알려줄 수 있어? 닭 냄새에 민감해.,1,,,,
삼계탕 만드는 방법 좀 가르쳐줄래?,1,,,,
삼계탕 만드는 법 알려줄래?,1,,,,
삼계탕 맛있게 만드는 법 알려줘,1,,,,
삼계탕 맛있게 만드는 법 좀 알려줄래?,1,,,,
삼계탕 황금레시피 좀 알려줘,1,,,,
삼색수제비 황금레시피 공유해줄래?,1,,,,
삼색태극말이초밥 만드는 방법 좀 가르쳐줄래?,1,,,,
상추겉절이비빔밥 맛있게 만드는 법 좀 알려줘.,1,,,,
상추채소무침 만드는 방법 좀 가르쳐줄래?,1,,,,
새송이산적 황금레시피 공유해줄래?,1,,,,
새우 볶음밥 맛있게 만드는 법 좀 알려줄래?,1,,,,
새우 칵테일 어떻게 만들면 좋을까?,1,,,,
새우 탕수육 황금레시피 좀 알려줘,1,,,,
새우 튀김 맛있게 만드는 법 좀 알려줄래?,1,,,,
새우 파스타 맛있게 만드는 법 좀 알려줄래?,1,,,,
새우만두 황금레시피 공유해줄래?,1,,,,
새우젓 만드는 법 좀 알려줄 수 있을까?,1,,,,
새우죽 만드는 법 알려줄래?,1,,,,
새우튀김 맛있게 만드는 법 좀 알려줄래?,1,,,,
샌드위치 맛있게 만드는 방법 좀 알려주세요. 맨날 똑같은 맛이야.,1,,,,
샐러드 니수아즈 황금레시피 좀 알려줄래?,1,,,,
샐러드 맛있게 만드는 방법 좀 알려줘! 질리는 드레싱 말고 새로운 거 먹고 싶어.,1,,,,
생새우초밥 맛있게 만드는 방법 알려줄래?,1,,,,
생선 탕수 황금 레시피 좀 공유해줄래?,1,,,,
생선까스 만드는 법 알려줘,1,,,,
생선초밥 만드는 방법 좀 가르쳐줄래?,1,,,,
생선탕수 만드는 방법 좀 가르쳐줄 수 있어?,1,,,,
생태 국 맛있게 만드는 방법 좀 알려줄래?,1,,,,
생태국 황금레시피 좀 공유해줄 수 있어?,1,,,,
생태매운탕 만드는 방법 좀 가르쳐줄래?,1,,,,
샤부샤부 황금레시피 좀 알려줘,1,,,,
샤브샤브 만드는 방법 좀 가르쳐줘.,1,,,,
샤브샤브 맛있게 만드는 법 좀 가르쳐줘.,1,,,,
샤오롱바오 만드는 방법 좀 알려줄래?,1,,,,
샹그리아 맛있게 만드는 법 좀 알려줄래? 과일 뭐 넣어야 맛있을까?,1,,,,
석박지 맛있게 만드는 방법 알려줘,1,,,,
선지 국 맛있게 만드는 방법 좀 알려줘.,1,,,,
선지국 만드는 방법 좀 가르쳐줄 수 있어?,1,,,,
선지해장국 맛있게 만드는 방법 알려줘,1,,,,
설렁탕 만드는 방법 좀 가르쳐줄래?,1,,,,
설렁탕 만드는 법 좀 알려줄 수 있을까?,1,,,,
설렁탕 어떻게 만들어야 맛있어?,1,,,,
설렁탕 황금레시피 좀 알려줘,1,,,,
성게알 맛있게 만드는 방법 알려줄래?,1,,,,
소갈비 맛있게 만드는 방법 알려줄래?,1,,,,
소갈비찜 맛있게 만드는 방법 알려줘,1,,,,
소고기 볶음 만드는 법 좀 공유해줘,1,,,,
소고기 육회 만드는 법 좀 알려줄래?,1,,,,
소고기 잡채 만드는 법 알려줄래?,1,,,,
소고기무국 만드는 법 좀 알려줄 수 있을까?,1,,,,
소바정식 만드는 방법 좀 가르쳐줄래?,1,,,,
속채운감자 만드는 방법 좀 가르쳐줄래?,1,,,,
송편 만드는 방법 좀 가르쳐줄래?,1,,,,
송편 만드는 법 알려줘,1,,,,
쇠고기 산적 맛있게 만드는 법 좀 알려줄래?,1,,,,
쇠고기 스튜 만드는 법 좀 공유해줘,1,,,,
쇠고기 스튜 맛있게 만드는 방법 알려줄 수 있어?,1,,,,
쇠고기 양송이 볶음 황금 레시피 좀 공유해줄래?,1,,,,
쇠고기 장조림 맛있게 만드는 방법 좀 알려줘.,1,,,,
쇠고기무국 만드는 방법 좀 가르쳐줄래?,1,,,,
쇠고기버섯덮밥 맛있게 만드는 법 좀 알려줘.,1,,,,
쇠고기산적 황금레시피 공유해줄래?,1,,,,
쇠고기양송이볶음 맛있게 만드는 방법 좀 알려줘.,1,,,,
쇠고기완자찜 만드는 방법 좀 가르쳐줄래?,1,,,,
쇠고기장조림 맛있게 만드는 법 좀 알려줘.,1,,,,
쇠고기전골 맛있게 만드는 법 좀 알려줘.,1,,,,
수육 맛있게 만드는 방법 알고 싶어,1,,,,
수육 맛있게 만드는 방법 좀 알려줘,1,,,,
수정과 황금레시피 공유해줄래?,1,,,,
수제비 만드는 법 알려줄래?,1,,,,
숙주미나리무침 맛있게 만드는 법 좀 알려줘.,1,,,,
순대 맛있게 만드는 방법 알려줄래?,1,,,,
순대볶음 맛있게 만드는 법 좀 알려줘.,1,,,,
순두부 찌개 맛있게 만드는 법 좀 가르쳐줘.,1,,,,
순두부찌개 맛있게 만드는 방법 알려줘,1,,,,
순두부찌개 맛있게 만드는 법 알려줘,1,,,,
순두부찌개 맛있게 만드는 법 좀 알려줄래?,1,,,,
순두부찌개 어떻게 만들면 좋을까?,1,,,,
순두부찌개 황금레시피 공유해줄래?,1,,,,
순두부찌개 황금레시피 좀 알려줘,1,,,,
술떡 맛있게 만드는 방법 알려줄 수 있어?,1,,,,
숯불닭갈비 맛있게 만드는 방법 알려줄래?,1,,,,
쉬림프 샐러드 맛있게 만드는 법 좀 알려줄래?,1,,,,
쉬림프 스캠피 맛있게 만드는 법 공유해줘,1,,,,
쉬림프 스캠피 황금레시피 좀 알려줘,1,,,,
쉬림프 요리 만드는 법 좀 공유해줘,1,,,,
쉬림프 프라이드 라이스 황금레시피 좀 알려줘,1,,,,
슈크림빵 맛있게 만드는 방법 알고 싶어,1,,,,
스시 만드는 법 알려줄 수 있어?,1,,,,
스시 황금레시피 좀 공유해줘!,1,,,,
스크램블 에그 촉촉하게 만드는 비법 좀 알려주라. 맨날 퍽퍽해.,1,,,,
스키야키 맛있게 만드는 법 좀 알려줄 수 있을까?,1,,,,
스테이크 굽기 정도는 어떻게 맞추는 게 좋을까? 레스토랑처럼 굽고 싶어.,1,,,,
스테이크 다이안 황금레시피 좀 알려줘,1,,,,
스테이크 만드는 법 좀 알려줄 수 있어?,1,,,,
스테이크 맛있게 만드는 방법 알려줘,1,,,,
스테이크 샌드위치 만드는 법 좀 공유해줘,1,,,,
스테이크 샐러드 만드는 법 좀 공유해줘,1,,,,
스테이크 타르타르 맛있게 만드는 법 공유해줄래?,1,,,,
스테이크 파히타 맛있게 만드는 법 좀 알려줄래?,1,,,,
스테키동 맛있게 만드는 방법 알고 싶어,1,,,,
스파게티 볼로네제 맛있게 만드는 법 좀 알려줘!,1,,,,
스파게티 알리오 올리오 만드는 방법 좀 알려줘,1,,,,
스파게티 카르보나라 맛있게 만드는 법 좀 알려줄래?,1,,,,
스페니쉬 오믈렛 만드는 방법 좀 알려줄래?,1,,,,
시금치 라자냐 만드는 법 좀 알려줄 수 있어?,1,,,,
시금치 리조또 만드는 법 좀 공유해줘,1,,,,
시금치 파스타 만드는 법 좀 공유해줘,1,,,,
시금치된장국 맛있게 만드는 법 좀 알려줘.,1,,,,
시금치된장죽 만드는 방법 좀 가르쳐줄래?,1,,,,
시금치샐러드 맛있게 만드는 법 좀 알려줘.,1,,,,
시저 샐러드 만드는 법 좀 알려줘,1,,,,
시저 샐러드 황금레시피 좀 알려줘,1,,,,
식혜 만드는 법 알려줄래?,1,,,,
쌀국수 만드는 법 알려줘,1,,,,
쌀국수 맛있게 만드는 방법 좀 알려줄 수 있어? 밖에서 사 먹는 맛이 안 나.,1,,,,
쌈장 만드는 법 알려줄래?,1,,,,
쌈장 맛있게 만드는 법 좀 알려줘.,1,,,,
쌈장 어떻게 만들면 좋을까?,1,,,,
쑥버섯볶음 맛있게 만드는 법 좀 알려줘.,1,,,,
쑥브리오슈 맛있게 만드는 법 좀 알려줘.,1,,,,
아구 탕 어떻게 만들어야 맛있어?,1,,,,
아구탕 황금레시피 공유해줄래?,1,,,,
아귀찜 황금레시피 공유해줄래?,1,,,,
아스파라거스새우볶음 만드는 방법 좀 가르쳐줄래?,1,,,,
아욱국 맛있게 만드는 법 좀 알려줘.,1,,,,
아이리시 스튜 만드는 법 좀 알려줄래?,1,,,,
안동찜닭 만드는 법 알려줘,1,,,,
안심스테이크 만드는 방법 좀 가르쳐줄래?,1,,,,
알 탕 황금 레시피 좀 공유해줄래?,1,,,,
알리오 올리오 황금레시피 좀 알려줘,1,,,,
알밥 만드는 법 좀 알려줄래?,1,,,,
알탕 맛있게 만드는 법 좀 알려줘.,1,,,,
알프레도 파스타 황금레시피 좀 알려줘,1,,,,
애플파이 맛있게 만드는 법 좀 알려줄래?,1,,,,
애호박무침 황금레시피 공유해줄래?,1,,,,
야채볶음 맛있게 만드는 법 좀 알려줄래?,1,,,,
야쿠르트 만드는 법 좀 알려줄 수 있을까?,1,,,,
야키소바 만드는 법 알려줘,1,,,,
야키소바 황금레시피 좀 알려줘,1,,,,
약과 황금레시피 공유해줄래?,1,,,,
약식 만드는 방법 공유해줄래?,1,,,,
약식 만드는 방법 좀 알려줄래?,1,,,,
양고기 스테이크 맛있게 만드는 방법 좀 알려줘!,1,,,,
양꼬치 만드는 법 알려줘,1,,,,
양념갈비 만드는 법 좀 알려줄 수 있을까?,1,,,,
양념게장 맛있게 만드는 방법 알려줘,1,,,,
양배추 말이찜 어떻게 만들어야 맛있어?,1,,,,
양배추말이찜 황금레시피 좀 공유해줄래?,1,,,,
양배춧국 만드는 방법 좀 가르쳐줄래?,1,,,,
양상추튀김 황금레시피 공유해줄래?,1,,,,
양송이버섯죽 만드는 방법 좀 가르쳐줄래?,1,,,,
