sentence,intent,,,,
그래. 결국에는 어쩔 수 없지. 나갈 수 없으니까 집에서 휴식을 취하면서 맛있는거나 해 먹어야겠어.,0,,,,
내가 찍은 사진이 확실한 증거니까 적당한 조치를 취해주겠지?,0,,,,
너가 생각해도 그렇지? 나도 그렇게 생각해.,0,,,,
나도 정말 꿈인줄 알았어. 꿈이라기엔 너무 생생하게 이상한 소리였어.,0,,,,
다른 사람들이 유튜버 말만 듣고 제품을 샀잖아!,0,,,,
내가 1등이야!,0,,,,
눈치 보여서 일찍 퇴근도 못 하지.,0,,,,
고마워. 너 밖에 없다.,0,,,,
그래. 위로해줘서 고마워.,0,,,,
너무 좋다! 고마워.,0,,,,
다들 힘들어 하지. 특히 엄마가 많이 힘들어 하셔.,0,,,,
"나? 음, 나 그냥 발라드 같은 거 좋아해.",0,,,,
근처 갔더니 내쫓더라고.,0,,,,
나야 항상 편하게 일하고 있어.,0,,,,
"그렇지만 일을 실수한 건 내 책임이니까.	",0,,,,
그것도 좋지. 맛있는 것도 많이 먹고싶다.,0,,,,
"그렇게는 하고 싶은데, 회사 생활이 녹록지가 않네. 일찍 퇴근은 절대 못 하겠지?",0,,,,
그러게 말이다. 이걸 어떻게 치우면 되니.,0,,,,
곰팡이가 없어지잖아.,0,,,,
다들 포기한 상태야. 자꾸 그러시니까 말하기도 싫어.,0,,,,
그것도 좋은데 운동하고 싶어요.,0,,,,
"냉장고 안에 반찬이 조금 남아 있는데 그걸로 2주를 버텨야 해.	",0,,,,
"그래, 그냥 내가 능력자라서 그런가보다 라고 생각을 해봐야겠지. 그래, 그렇게 생각하자.",0,,,,
난 많이 행복했어.,0,,,,
그래 너무 고맙다.,0,,,,
새로 오픈한 집이어서 시켜본 건데 이게 뭐야.,0,,,,
너무나 많은 일로 내가 스트레스 받고 지쳐서 버틸 수 있을 지 모르겠어.,0,,,,
내가 들고 있는 주식은 괜찮은 주식이야. 생명과학 분야야.,0,,,,
"그러고 싶은데 일이 바빠서 시간을 못 내 우선은 일을 끝내고 뭘 하든지 해야지.	",0,,,,
나 지금 배고파.,0,,,,
그니까! 목줄이 약했나봐.,0,,,,
나를 받아주는 곳이 있을까?,0,,,,
괜찮아질까?,0,,,,
계속 진행해 온 프로젝트가 잘 풀리지 않는 것 같아. 그래서 마음이 우울해!,0,,,,
그렇지. 강아지들이 크면서 키우기가 힘들어지니까 버리는 거지.,0,,,,
관리하시는 분은 무슨 죄냐고. 어떻게 말씀드려야 될지 모르겠어.,0,,,,
너의 말처럼 약속 장소를 옮겨보는 것도 좋은 방법인 것 같아. 친구한테 이야기 해봐야 될 것 같아.,0,,,,
그래야겠지? 지금은 괜찮아. 상황봐서 조금 더 진정이 안 되면 한 번 병원에 가봐야겠지?,0,,,,
그래도 이제 이번 달까지만 하고 정리하자고 할까 고민 중이야.,0,,,,
니 말이 맞긴 한데 그래도 너무 화가 나!,0,,,,
너무 스트레스 받아서 이제는 너무 지쳐!,0,,,,
그렇지. 그런 것도 있는 것 같아. 요즘 너무 생각해야 될 게 많아.,0,,,,
"갑자기 일어난 지진 때문에 사람들이 여기저기 넘어졌어. 하지만 크게 다친 사람들이 없어서, 정말 다행이었어.",0,,,,
내가 예전부터 받고 싶었던 향수를 선물로 받아서 엄청 마음에 들어!,0,,,,
글쎄? 경찰들 여러 명 있는 거 보니까 그런 것 같은데?,0,,,,
내 기획안 거절 당하고 왔어.,0,,,,
그래. 혼자 집에 가있어.,0,,,,
그렇지 않아도 생각 안 해본 건 아니야.근데 너무 아깝잖아 여기까지 다닌 게.,0,,,,
김치찌개 레시피 좀 알려주세요,1,,,,
스파게티 만드는 법 가르쳐 주세요,1,,,,
갈비찜은 어떻게 만들어야 하나요?,1,,,,
김치찌개 레시피가 필요해요.,1,,,,
김치찌개 만드는 법 좀 알려주세요.,1,,,,
김치찌개 요리법을 알고 싶어요.,1,,,,
김치찌개 어떻게 만들어요?,1,,,,
김치찌개 레시피 알려줄래요?,1,,,,
김치찌개 요리하는 방법 좀 가르쳐주세요.,1,,,,
김치찌개 만드는 방법 알려주세요.,1,,,,
김치찌개 레시피 부탁드립니다.,1,,,,
김치찌개 만드는 법을 알고 싶어요.,1,,,,
김치찌개 요리법 좀 알려주시겠어요?,1,,,,
된장찌개 레시피가 필요해요.,1,,,,
된장찌개 만드는 법 좀 알려주세요.,1,,,,
된장찌개 요리법을 알고 싶어요.,1,,,,
된장찌개 어떻게 만들어요?,1,,,,
된장찌개 레시피 알려줄래요?,1,,,,
된장찌개 요리하는 방법 좀 가르쳐주세요.,1,,,,
된장찌개 만드는 방법 알려주세요.,1,,,,
된장찌개 레시피 부탁드립니다.,1,,,,
된장찌개 만드는 법을 알고 싶어요.,1,,,,
된장찌개 요리법 좀 알려주시겠어요?,1,,,,
불고기 레시피가 필요해요.,1,,,,
불고기 만드는 법 좀 알려주세요.,1,,,,
불고기 요리법을 알고 싶어요.,1,,,,
불고기 어떻게 만들어요?,1,,,,
불고기 레시피 알려줄래요?,1,,,,
불고기 요리하는 방법 좀 가르쳐주세요.,1,,,,
불고기 만드는 방법 알려주세요.,1,,,,
불고기 레시피 부탁드립니다.,1,,,,
불고기 만드는 법을 알고 싶어요.,1,,,,
불고기 요리법 좀 알려주시겠어요?,1,,,,
비빔밥 레시피가 필요해요.,1,,,,
비빔밥 만드는 법 좀 알려주세요.,1,,,,
비빔밥 요리법을 알고 싶어요.,1,,,,
비빔밥 어떻게 만들어요?,1,,,,
비빔밥 레시피 알려줄래요?,1,,,,
비빔밥 요리하는 방법 좀 가르쳐주세요.,1,,,,
비빔밥 만드는 방법 알려주세요.,1,,,,
비빔밥 레시피 부탁드립니다.,1,,,,
비빔밥 만드는 법을 알고 싶어요.,1,,,,
비빔밥 요리법 좀 알려주시겠어요?,1,,,,
잡채 레시피가 필요해요.,1,,,,
잡채 만드는 법 좀 알려주세요.,1,,,,
잡채 요리법을 알고 싶어요.,1,,,,
잡채 어떻게 만들어요?,1,,,,
잡채 레시피 알려줄래요?,1,,,,
잡채 요리하는 방법 좀 가르쳐주세요.,1,,,,
잡채 만드는 방법 알려주세요.,1,,,,
잡채 레시피 부탁드립니다.,1,,,,
잡채 만드는 법을 알고 싶어요.,1,,,,
잡채 요리법 좀 알려주시겠어요?,1,,,,
떡볶이 레시피가 필요해요.,1,,,,
떡볶이 만드는 법 좀 알려주세요.,1,,,,
떡볶이 요리법을 알고 싶어요.,1,,,,
떡볶이 어떻게 만들어요?,1,,,,
떡볶이 레시피 알려줄래요?,1,,,,
떡볶이 요리하는 방법 좀 가르쳐주세요.,1,,,,
떡볶이 만드는 방법 알려주세요.,1,,,,
떡볶이 레시피 부탁드립니다.,1,,,,
떡볶이 만드는 법을 알고 싶어요.,1,,,,
떡볶이 요리법 좀 알려주시겠어요?,1,,,,
라면 레시피가 필요해요.,1,,,,
라면 만드는 법 좀 알려주세요.,1,,,,
라면 요리법을 알고 싶어요.,1,,,,
라면 어떻게 만들어요?,1,,,,
라면 레시피 알려줄래요?,1,,,,
라면 요리하는 방법 좀 가르쳐주세요.,1,,,,
라면 만드는 방법 알려주세요.,1,,,,
라면 레시피 부탁드립니다.,1,,,,
라면 만드는 법을 알고 싶어요.,1,,,,
라면 요리법 좀 알려주시겠어요?,1,,,,
갈비찜 레시피가 필요해요.,1,,,,
갈비찜 만드는 법 좀 알려주세요.,1,,,,
갈비찜 요리법을 알고 싶어요.,1,,,,
갈비찜 어떻게 만들어요?,1,,,,
갈비찜 레시피 알려줄래요?,1,,,,
갈비찜 요리하는 방법 좀 가르쳐주세요.,1,,,,
갈비찜 만드는 방법 알려주세요.,1,,,,
갈비찜 레시피 부탁드립니다.,1,,,,
갈비찜 만드는 법을 알고 싶어요.,1,,,,
갈비찜 요리법 좀 알려주시겠어요?,1,,,,
삼계탕 레시피가 필요해요.,1,,,,
삼계탕 만드는 법 좀 알려주세요.,1,,,,
삼계탕 요리법을 알고 싶어요.,1,,,,
삼계탕 어떻게 만들어요?,1,,,,
삼계탕 레시피 알려줄래요?,1,,,,
삼계탕 요리하는 방법 좀 가르쳐주세요.,1,,,,
삼계탕 만드는 방법 알려주세요.,1,,,,
삼계탕 레시피 부탁드립니다.,1,,,,
삼계탕 만드는 법을 알고 싶어요.,1,,,,
삼계탕 요리법 좀 알려주시겠어요?,1,,,,
순두부찌개 레시피가 필요해요.,1,,,,
순두부찌개 만드는 법 좀 알려주세요.,1,,,,
순두부찌개 요리법을 알고 싶어요.,1,,,,
순두부찌개 어떻게 만들어요?,1,,,,
순두부찌개 레시피 알려줄래요?,1,,,,
순두부찌개 요리하는 방법 좀 가르쳐주세요.,1,,,,
순두부찌개 만드는 방법 알려주세요.,1,,,,
순두부찌개 레시피 부탁드립니다.,1,,,,
순두부찌개 만드는 법을 알고 싶어요.,1,,,,
순두부찌개 요리법 좀 알려주시겠어요?,1,,,,
밀푀유나베 어떻게 만들어?,1,,,,
두부조림 만드는 방법이 궁금해,1,,,,
오믈렛은 어떻게 만들어야 할까?,1,,,,
알리오올리오 파스타 만들어보고 싶어,1,,,,
사케동은 어떻게 만들수 있어?,1,,,,
LA갈비 맛있게 만드는 방법 알고 싶어,1,,,,
가는파 잡채 어떻게 만들어야 맛있어?,1,,,,
가는파잡채 황금레시피 공유해줄래?,1,,,,
가래떡꼬치 만드는 방법 좀 가르쳐줄래?,1,,,,
가리비구이 맛있게 만드는 방법 알려줄래?,1,,,,
가지 튀김 만드는 법 좀 알려줄 수 있어?,1,,,,
가지된장찜 만드는 방법 좀 가르쳐줄래?,1,,,,
가지쇠고기볶음 만드는 방법 좀 가르쳐줄래?,1,,,,
가지와 마른새우 무침 어떻게 만들어야 해?,1,,,,
가지와 마른새우무침 황금레시피 공유해줄래?,1,,,,
가츠동 맛있게 만드는 방법 좀 알려주세요! 돈까스 눅눅해지는 게 싫어.,1,,,,
가츠동 맛있게 만드는 법 알고 싶어,1,,,,
간장게장 맛있게 만드는 방법 좀 알려줄래?,1,,,,
간장떡볶이 만드는 방법 좀 가르쳐줄래?,1,,,,
간장새우 만드는 법 알려줄래?,1,,,,
갈릭 브레드 만드는 법 좀 알려줄 수 있어?,1,,,,
갈비 구이 어떻게 만들어야 맛있어?,1,,,,
갈비구이 황금레시피 공유해줄래?,1,,,,
갈비떡볶이 만드는 방법 좀 가르쳐줄래?,1,,,,
갈비찜 고기 부드럽게 만드는 방법 좀 알려주세요! 맨날 질겨서 턱 아파.,1,,,,
갈비찜 만드는 방법 좀 알려줘,1,,,,
갈비찜 만드는 법 좀 알려줄 수 있을까?,1,,,,
갈비찜 맛있게 만드는 법 알려줘,1,,,,
갈비찜 맛있게 만드는 법 좀 가르쳐줘.,1,,,,
갈비찜 맛있게 만드는 법 좀 알려줄래?,1,,,,
갈비찜 황금 레시피 좀 알려줄래?,1,,,,
갈비찜 황금레시피 좀 알려줘,1,,,,
갈비탕 깊은 맛 내는 방법이 뭐야? 밖에서 사 먹는 맛 내고 싶어.,1,,,,
갈비탕 만드는 방법 좀 가르쳐줄래?,1,,,,
갈비탕 만드는 법 알려줄래?,1,,,,
갈비탕 맛있게 만드는 법 좀 알려줄래?,1,,,,
갈비탕 어떻게 만들면 좋을까?,1,,,,
갈비탕 어떻게 만들어야 해?,1,,,,
갈치 무조림 황금 레시피 좀 알려줄래?,1,,,,
갈치무조림 황금레시피 좀 공유해줘.,1,,,,
갈치조림 맛있게 만드는 법 좀 알려줄래?,1,,,,
갈치조림 황금레시피 좀 알려줘,1,,,,
감바스 맛있게 만드는 법 공유해줘,1,,,,
감바스 알 아히요 맛있게 만드는 법 좀 알려줄래?,1,,,,
감바스 황금레시피 좀 알려줘,1,,,,
감자 고추채 볶음 황금 레시피 좀 알려줄래?,1,,,,
감자 샐러드 만드는 법 좀 알려줄 수 있어?,1,,,,
감자 수제비 맛있게 만드는 방법 좀 알려줘.,1,,,,
감자 조림 황금 레시피 좀 공유해줄래?,1,,,,
감자 탕 황금 레시피 좀 알려줘.,1,,,,
감자고추채볶음 맛있게 만드는 법 좀 알려줘.,1,,,,
감자국수 황금레시피 공유해줄래?,1,,,,
감자그라탕 맛있게 만드는 법 좀 알려줘.,1,,,,
감자떡 맛있게 만드는 방법 알려줘,1,,,,
감자수제비 맛있게 만드는 법 알려줄래?,1,,,,
감자수프 만드는 방법 좀 가르쳐줄래?,1,,,,
감자조림 맛있게 만드는 법 좀 알려줄래?,1,,,,
감자조림 맛있게 만드는 법 좀 알려줘.,1,,,,
감자탕 만드는 방법 좀 알려줄래?,1,,,,
감자탕 맛있게 만드는 법 알려줘,1,,,,
감자탕 맛있게 만드는 법 좀 알려줄래?,1,,,,
감자탕 맛있게 만드는 법 좀 알려줘.,1,,,,
감자탕 어떻게 만들면 맛있게 할 수 있을까?,1,,,,
갓 김치 어떻게 만들어야 맛있어?,1,,,,
갓김치 황금레시피 좀 공유해줄래?,1,,,,
겉절이 맛있게 만드는 방법 알려줘,1,,,,
게살 스프 만드는 법 좀 공유해줘,1,,,,
게살 파스타 황금레시피 좀 알려줘,1,,,,
계란말이 만드는 방법 좀 가르쳐줄래?,1,,,,
계란말이 만드는 법 알려줘,1,,,,
계란말이 맛있게 만드는 법 좀 가르쳐줘.,1,,,,
계란말이 맛있게 만드는 법 좀 알려줄래?,1,,,,
계란말이 황금레시피 좀 알려줘,1,,,,
계란말이주먹밥 맛있게 만드는 법 좀 알려줘.,1,,,,
계란찜 만드는 방법 좀 가르쳐줄래?,1,,,,
계란찜 어떻게 만들면 좋을까?,1,,,,
고구마그라탱 황금레시피 공유해줄래?,1,,,,
고구마밥 맛있게 만드는 방법 알고 싶어,1,,,,
고구마빵 만드는 법 알려줘,1,,,,
고구마줄기볶음 맛있게 만드는 법 좀 알려줘.,1,,,,
고들빼기김치 만드는 방법 좀 가르쳐줄래?,1,,,,
고등어 살튀김과 소스 황금 레시피 좀 알려줘.,1,,,,
고등어구이 맛있게 만드는 방법 알려줘,1,,,,
고등어구이 맛있게 만드는 법 알려줘,1,,,,
고등어김치조림 만드는 방법 좀 가르쳐줄래?,1,,,,
고등어김치찜 황금레시피 좀 알려줘,1,,,,
고등어된장조림 만드는 방법 좀 가르쳐줄래?,1,,,,
고등어무조림 황금레시피 공유해줄래?,1,,,,
고등어조림 어떻게 만들면 좋을까?,1,,,,
고사리 만드는 법 알려줘,1,,,,
고추부각 만드는 방법 좀 가르쳐줄래?,1,,,,
고추잡채 만드는 법 좀 알려줄 수 있을까?,1,,,,
고추잡채 맛있게 만드는 법 알고 싶어,1,,,,
고추잡채 맛있게 만드는 법 좀 알려줄래?,1,,,,
고추잡채 어떻게 만들면 좋을까?,1,,,,
고추잡채 황금레시피 좀 알려줘,1,,,,
고추장스파게티 만드는 방법 좀 가르쳐줄래?,1,,,,
고추장아찌 맛있게 만드는 법 좀 알려줘.,1,,,,
고추장찌개 맛있게 만드는 방법 알고 싶어,1,,,,
고추장찌개 어떻게 만들면 좋을까?,1,,,,
고추장찌개 황금레시피 좀 알려줘,1,,,,
고춧기름 황금레시피 공유해줄래?,1,,,,
골뱅이 무침 어떻게 만들어야 맛있어?,1,,,,
골뱅이무침 맛있게 만드는 방법 알려줘,1,,,,
골뱅이무침 황금레시피 공유해줄래?,1,,,,
골뱅이소면무침 만드는 법 알려줘,1,,,,
곰탕 만드는 법 좀 가르쳐줘.,1,,,,
곰탕 맛있게 만드는 방법 알려줘,1,,,,
곰탕 황금레시피 좀 공유해줄래?,1,,,,
곱창 만드는 법 좀 알려줄 수 있을까?,1,,,,
곱창전골 맛있게 만드는 법 좀 알려줘.,1,,,,
과일샐러드 황금레시피 공유해줄래?,1,,,,
관자 맛있게 만드는 방법 알려줄래?,1,,,,
광어회 맛있게 만드는 방법 알려줄래?,1,,,,
구운 감자 만드는 법 좀 알려줄래?,1,,,,
구운 감자와 도미 구이 어떻게 만들어야 해?,1,,,,
구운 마늘 새우 맛있게 만드는 법 알려줄래?,1,,,,
구운 아스파라거스 맛있게 만들려면 어떻게 해야 해?,1,,,,
구운 야채 만드는 법 좀 공유해줘,1,,,,
구운 야채 맛있게 만드는 법 좀 알려줄래?,1,,,,
구운 연어 만드는 법 좀 알려줄 수 있어?,1,,,,
구운 연어 맛있게 만드는 법 좀 알려줄래?,1,,,,
구운 치킨 맛있게 만드는 법 좀 알려줄래?,1,,,,
구운감자와 도미구이 만드는 법 좀 알려줄래?,1,,,,
국물닭발 맛있게 만드는 방법 알고 싶어,1,,,,
국수 계란말이 어떻게 만들어야 맛있어?,1,,,,
국수 전골 황금 레시피 좀 알려줄래?,1,,,,
국수계란말이 황금레시피 좀 공유해줄래?,1,,,,
국수전골 맛있게 만드는 법 좀 알려줘.,1,,,,
군만두 만드는 법 좀 알려줄 수 있을까?,1,,,,
군밤 만드는 법 좀 알려줄 수 있을까?,1,,,,
굴 깍두기 맛있게 만드는 방법 좀 가르쳐줘.,1,,,,
굴 만드는 법 좀 알려줄 수 있을까?,1,,,,
굴깍두기 만드는 방법 좀 가르쳐줄래?,1,,,,
규동 만드는 법 알려줄래?,1,,,,
규동 맛있게 만드는 레시피 좀 공유해줄 수 있니?,1,,,,
그릭 샐러드 어떻게 만들면 맛있게 할 수 있을까?,1,,,,
그린파스타 황금레시피 공유해줄래?,1,,,,
기스면 황금레시피 공유해줄래?,1,,,,
김말이튀김 만드는 법 알려줄래?,1,,,,
김밥 맛있게 만드는 방법 알고 싶어,1,,,,
김밥 맛있게 싸는 비법 좀 알려주라!,1,,,,
김밥 어떻게 만들면 좋을까?,1,,,,
김치 적 황금 레시피 좀 알려줄래?,1,,,,
김치 찌개 황금 레시피 좀 알려줄래?,1,,,,
김치꽁치조림 맛있게 만드는 법 좀 알려줘.,1,,,,
김치동그랑땡 맛있게 만드는 법 좀 알려줘.,1,,,,
김치두부쌈 황금레시피 공유해줄래?,1,,,,
김치만두 맛있게 만드는 방법 알려줄래?,1,,,,
김치말이국수 어떻게 만들면 좋을까?,1,,,,
김치볶음 맛있게 만드는 법 알려줘,1,,,,
김치볶음밥 맛있게 만드는 법 좀 알려줄래?,1,,,,
김치볶음밥 맛있게 만드는 법 좀 알려줘.,1,,,,
김치볶음밥 어떻게 만들면 좋을까?,1,,,,
김치부침개 황금레시피 좀 알려줘,1,,,,
김치수제비 만드는 방법 좀 가르쳐줄래?,1,,,,
김치쌈밥 황금레시피 공유해줄래?,1,,,,
김치어묵 황금레시피 공유해줄래?,1,,,,
김치적 만드는 방법 좀 가르쳐줄래?,1,,,,
김치전 만드는 법 좀 알려줄 수 있을까?,1,,,,
김치전 맛있게 만드는 법 좀 알려줄래?,1,,,,
김치전 바삭하게 부치는 방법 좀 알려주세요! 눅눅한 게 싫어.,1,,,,
김치전 황금레시피 좀 알려줘,1,,,,
김치주먹밥 만드는 방법 좀 가르쳐줄래?,1,,,,
김치찌개 만드는 법 좀 공유해줘,1,,,,
김치찌개 맛있게 끓이는 방법 좀 알려줄 수 있어?,1,,,,
김치찌개 맛있게 만드는 법 좀 알려줄래?,1,,,,
김치찌개 맛있게 만드는 법 좀 알려줘.,1,,,,
김치찌개 황금레시피 좀 알려줘,1,,,,
김치찌개에 참치 넣으면 맛있을까? 꿀조합 레시피 좀 알려줘!,1,,,,
김치찜 맛있게 만드는 법 좀 알려줄래?,1,,,,
김치찜 황금레시피 좀 알려줘,1,,,,
김치채소볶음 황금레시피 공유해줄래?,1,,,,
김치채소쌈 황금레시피 공유해줄래?,1,,,,
김치피자 맛있게 만드는 법 좀 알려줘.,1,,,,
까르보나라 스파게티 어떻게 만들어야 해?,1,,,,
까르보나라떡볶이 맛있게 만드는 방법 알려줄래?,1,,,,
까르보나라스파게티 황금레시피 공유해줄래?,1,,,,
깍두기 만드는 법 알려줄래?,1,,,,
깍두기 어떻게 만들면 좋을까?,1,,,,
깍두기 황금레시피 좀 알려줘,1,,,,
깐쇼새우 만드는 법 알려줄래?,1,,,,
깐쇼새우 만드는 법 알려줘,1,,,,
깐풍기 만드는 방법 좀 가르쳐줄래?,1,,,,
깐풍기 만드는 법 좀 알려줘,1,,,,
깐풍기 맛있게 만드는 방법 알려줄 수 있을까?,1,,,,
깐풍기 맛있게 만드는 방법 알려줘,1,,,,
깐풍새우 만드는 방법 좀 가르쳐줄래?,1,,,,
깐풍육 맛있게 만드는 레시피 좀 공유해줄 수 있니?,1,,,,
깻잎 장아찌 만드는 법 좀 가르쳐줘.,1,,,,
깻잎장아찌 맛있게 만드는 법 좀 알려줘.,1,,,,
꼬리 곰탕 맛있게 만드는 법 좀 가르쳐줘.,1,,,,
꼬리곰탕 황금레시피 공유해줄래?,1,,,,
꽁치 간장구이 맛있게 만드는 방법 좀 가르쳐줘.,1,,,,
꽁치 무조림 맛있게 만드는 법 좀 가르쳐줘.,1,,,,
꽁치간장구이 만드는 방법 좀 가르쳐줄래?,1,,,,
꽁치구이 황금레시피 공유해줄래?,1,,,,
꽁치무조림 황금레시피 공유해줄래?,1,,,,
꽃게 찌개 만드는 법 좀 알려줄래?,1,,,,
꽃게찌개 만드는 방법 좀 가르쳐줄래?,1,,,,
꽃게해물탕 황금레시피 공유해줄래?,1,,,,
꽃만두국(완당국) 맛있게 만드는 법 좀 알려줘.,1,,,,
꽃빵 만드는 법 알려줘,1,,,,
꽈배기도넛 만드는 법 알려줘,1,,,,
꿔바로우 튀김옷 바삭하게 만드는 비법 좀 알려주라.,1,,,,
나물 비빔밥 어떻게 만들어야 해?,1,,,,
나물비빔밥 맛있게 만드는 방법 좀 알려줄래?,1,,,,
나박 김치 황금 레시피 좀 알려줄래?,1,,,,
나박김치 맛있게 만드는 법 좀 알려줘.,1,,,,
나폴리탄 파스타 맛있게 만들려면 어떻게 해야 해?,1,,,,
낙지 볶음 어떻게 만들어야 맛있어?,1,,,,
낙지 전골 어떻게 만들어야 맛있어?,1,,,,
낙지볶음 맛있게 만드는 법 좀 알려줘.,1,,,,
낙지전골 황금레시피 좀 공유해줄래?,1,,,,
낙지젓 맛있게 만드는 방법 알려줘,1,,,,
남산왕돈까스 만드는 법 좀 알려줄 수 있을까?,1,,,,
냉고기쌈 만드는 방법 좀 가르쳐줄래?,1,,,,
냉면 만드는 방법 좀 공유해줄 수 있어?,1,,,,
냉면 만드는 법 공유해줄래?,1,,,,
냉이 된장찌개 황금 레시피 좀 알려줄래?,1,,,,
냉이된장국 만드는 법 알려줘,1,,,,
냉이된장찌개 황금레시피 좀 공유해줄래?,1,,,,
냉치킨 만드는 법 좀 알려줄 수 있을까?,1,,,,
녹차모찌 만드는 법 알려줘,1,,,,
녹차수제비 맛있게 만드는 법 좀 알려줘.,1,,,,
녹치케 맛있게 만드는 방법 알고 싶어,1,,,,
뇨끼 쫄깃하게 만드는 방법 좀 알려주라.,1,,,,
뇨키 황금레시피 좀 알려줘,1,,,,
누룽지탕 황금레시피 공유해줄래?,1,,,,
다시마 냉국 맛있게 만드는 방법 좀 알려줄래?,1,,,,
다시마냉국 어떻게 만드는지 알려줘.,1,,,,
다시마볶음 황금레시피 공유해줄래?,1,,,,
단팥죽 만드는 방법 좀 가르쳐줄래?,1,,,,
단호박튀김 황금레시피 공유해줄래?,1,,,,
달래굴파전 맛있게 만드는 법 좀 알려줘.,1,,,,
달래된장찌개 만드는 방법 좀 가르쳐줄래?,1,,,,
달래장김치 황금레시피 공유해줄래?,1,,,,
닭 불고기 맛있게 만드는 방법 좀 알려줘.,1,,,,
닭가슴살 샐러드 맛있게 만드는 법 공유해줄래?,1,,,,
닭가슴살 요리 맛있게 만드는 법 좀 알려줄래?,1,,,,
닭갈비 황금레시피 공유해줄래?,1,,,,
닭강정 만드는 법 알려줘,1,,,,
닭강정 맛있게 만드는 법 알려줘,1,,,,
닭강정 맛있게 만드는 법 좀 알려줘.,1,,,,
닭강정 바삭하고 맛있게 만드는 방법 좀 알려주세요! 눅눅해지는 게 싫어.,1,,,,
닭강정 황금 레시피 좀 공유해줄래?,1,,,,
닭개장 만드는 방법 좀 가르쳐줄래?,1,,,,
닭고기명란튀김 황금레시피 공유해줄래?,1,,,,
닭고기수삼샐러드 만드는 방법 좀 가르쳐줄래?,1,,,,
닭고기카레튀김 맛있게 만드는 법 좀 알려줘.,1,,,,
닭고기콩나물덮밥 맛있게 만드는 법 좀 알려줘.,1,,,,
닭꼬치구이 만드는 방법 좀 가르쳐줄래?,1,,,,
닭날개튀김 만드는 방법 좀 가르쳐줄래?,1,,,,
닭다리굴소스볶음 만드는 방법,1,,,,
닭다리굴소스볶음 만드는 방법 좀 가르쳐줄래?,1,,,,
닭도리탕 맛있게 만드는 방법 알려줘,1,,,,
닭도리탕 맛있게 만드는 법 좀 알려줄래?,1,,,,
닭똥집 맛있게 만드는 방법 알려줘,1,,,,
닭볶음탕 만드는 법 알려줄 수 있을까?,1,,,,
닭볶음탕 맛있게 만드는 법 좀 알려줄래?,1,,,,
닭불고기 만드는 방법 좀 알려줄 수 있어?,1,,,,
대구탕 맛있게 만드는 법 좀 알려줘.,1,,,,
대만식 닭날개 맛있게 만드는 법 공유해줘,1,,,,
대창 맛있게 만드는 방법 알려줘,1,,,,
대패삼겹살 맛있게 만드는 방법 알고 싶어,1,,,,
더덕 구이 맛있게 만드는 법 좀 알려줄래?,1,,,,
더덕구이 만드는 방법 좀 가르쳐줄래?,1,,,,
덴푸라 바삭하게 튀기는 방법 좀 알려줄래? 튀김은 항상 어려워.,1,,,,
도가니탕 맛있게 만드는 법 알려줘.,1,,,,
도가니탕 황금 레시피 좀 알려줄래?,1,,,,
도라지 맛있게 만드는 방법 알려줄래?,1,,,,
돈까스 만드는 방법 좀 알려줘.,1,,,,
돈까스 만드는 법 알려줄래?,1,,,,
돈까스 만드는 법 좀 가르쳐줘.,1,,,,
돈까스 바삭하게 튀기는 방법 좀 알려줘! 눅눅해지는 게 싫어.,1,,,,
돈까스덮밥 황금레시피 공유해줄래?,1,,,,
돈부리 맛있게 만드는 방법 알려줘,1,,,,
돈부리 맛있게 만드는 법 좀 알려줘.,1,,,,
돌솥비빔밥 만드는 법 알려줘,1,,,,
동그랑땡 만드는 법 알려줄래?,1,,,,
동지팥죽 황금레시피 공유해줄래?,1,,,,
동치미 막국수 어떻게 만들어야 해?,1,,,,
동치미 만드는 법 좀 알려줄 수 있을까?,1,,,,
동치미 맛있게 만드는 법 알려줄래.,1,,,,
동치미 맛있게 만드는 법 좀 알려줄래?,1,,,,
동치미 어떻게 만들면 좋을까?,1,,,,
동치미 황금 레시피 좀 공유해줄래?,1,,,,
동치미 황금레시피 좀 알려줘,1,,,,
동치미막국수 황금레시피 좀 알려줘.,1,,,,
동태 찌개 어떻게 만들어야 맛있어?,1,,,,
동태찌개 만드는 방법 좀 가르쳐줄래?,1,,,,
동태찌개 맛있게 만드는 법 좀 알려줄래?,1,,,,
동태찌개 어떻게 만들면 좋을까?,1,,,,
동태찌개 황금레시피 좀 알려줘,1,,,,
